{
  "id": "MOD-003-FEAT-005-STORY-006",
  "title": "Drag and drop deals between pipeline stages",
  "description": "As a sales representative, I want to drag and drop deal cards between pipeline stages, so that I can quickly update deal progress without opening detail views.",
  "featureId": "MOD-003-FEAT-005",
  "status": "in-progress",
  "acceptanceCriteria": [
    {
      "criterion": "Given I am viewing the pipeline board, when I drag a deal card from one stage to another, then the card moves smoothly with visual feedback",
      "verified": false
    },
    {
      "criterion": "Given I drop a deal card in a new stage, when the drop completes, then the deal's stage is updated in the database immediately",
      "verified": false
    },
    {
      "criterion": "Given a deal changes stage, when the update completes, then the deal probability is automatically updated based on the new stage",
      "verified": false
    },
    {
      "criterion": "Given I am dragging a deal, when I hover over an invalid drop zone, then visual feedback indicates the drop is not allowed",
      "verified": false
    }
  ],
  "definitionOfDone": [
    {
      "item": "Drag and drop functionality implemented with touch support",
      "completed": false
    },
    {
      "item": "Optimistic UI updates with rollback on failure",
      "completed": false
    },
    {
      "item": "Stage change API endpoint implemented",
      "completed": false
    },
    {
      "item": "Automatic probability updates working",
      "completed": false
    },
    {
      "item": "Activity log entry created for stage changes",
      "completed": false
    },
    {
      "item": "Unit and integration tests passing",
      "completed": false
    },
    {
      "item": "Accessibility testing completed (keyboard navigation)",
      "completed": false
    }
  ],
  "definitionOfReady": [
    {
      "item": "User story clearly defined",
      "ready": true
    },
    {
      "item": "Drag-and-drop library selected (react-beautiful-dnd)",
      "ready": true
    },
    {
      "item": "Design and animations approved",
      "ready": true
    },
    {
      "item": "Story estimated",
      "ready": true
    }
  ],
  "assignee": "chris.anderson",
  "storyPoints": 8,
  "priority": "critical",
  "metadata": {
    "createdAt": "2025-02-28T09:30:00Z",
    "updatedAt": "2025-03-02T11:15:00Z",
    "createdBy": "amanda.rodriguez",
    "tags": [
      "deals",
      "pipeline",
      "drag-drop",
      "ux"
    ]
  }
}
